{
  "format": "new-horizons-ui-layout",
  "version": 1,
  "status": "prototype",
  "name": "Level-up geometry prototype",
  "canvas": {
    "width": 640,
    "height": 568
  },
  "grid": {
    "size": 8,
    "snap": true
  },
  "materials": {
    "leather": {
      "kind": "tile",
      "resource": "core:DiBoxBck",
      "tileWidth": 64,
      "tileHeight": 64,
      "origin": "canvas",
      "preview": "leather"
    }
  },
  "layers": [
    {
      "id": "background",
      "type": "panel",
      "label": "",
      "x": 0,
      "y": 0,
      "w": 640,
      "h": 568,
      "anchor": "top-left",
      "binding": "",
      "material": "leather",
      "assetRef": "",
      "visible": true,
      "locked": true
    },
    {
      "id": "border",
      "type": "frame",
      "label": "Separate border",
      "x": 0,
      "y": 0,
      "w": 640,
      "h": 568,
      "anchor": "top-left",
      "binding": "",
      "material": "",
      "assetRef": "",
      "visible": true,
      "locked": true
    },
    {
      "id": "banner",
      "type": "banner",
      "label": "Hero level-up",
      "x": 150,
      "y": 12,
      "w": 340,
      "h": 42,
      "anchor": "top-left",
      "binding": "hero.name",
      "material": "",
      "assetRef": "",
      "visible": true,
      "locked": false
    },
    {
      "id": "crest",
      "type": "crest",
      "label": "Crest",
      "x": 568,
      "y": 22,
      "w": 44,
      "h": 44,
      "anchor": "top-left",
      "binding": "hero.faction",
      "material": "",
      "assetRef": "",
      "visible": true,
      "locked": false
    },
    {
      "id": "portrait",
      "type": "hero",
      "label": "Hero portrait",
      "x": 297,
      "y": 66,
      "w": 58,
      "h": 64,
      "anchor": "top-left",
      "binding": "hero.portrait",
      "material": "",
      "assetRef": "",
      "visible": true,
      "locked": false
    },
    {
      "id": "level",
      "type": "text",
      "label": "Level / class",
      "x": 150,
      "y": 146,
      "w": 340,
      "h": 32,
      "anchor": "top-left",
      "binding": "hero.level",
      "material": "",
      "assetRef": "",
      "visible": true,
      "locked": false
    },
    {
      "id": "attack",
      "type": "icon",
      "label": "attack",
      "x": 36,
      "y": 196,
      "w": 42,
      "h": 42,
      "anchor": "top-left",
      "binding": "primary.attack",
      "material": "",
      "assetRef": "",
      "visible": true,
      "locked": false
    },
    {
      "id": "attack-gain",
      "type": "text",
      "label": "Gain",
      "x": 80,
      "y": 196,
      "w": 90,
      "h": 52,
      "anchor": "top-left",
      "binding": "primary.attack.gain",
      "material": "",
      "assetRef": "",
      "visible": true,
      "locked": false
    },
    {
      "id": "defense",
      "type": "icon",
      "label": "defense",
      "x": 184,
      "y": 196,
      "w": 42,
      "h": 42,
      "anchor": "top-left",
      "binding": "primary.defense",
      "material": "",
      "assetRef": "",
      "visible": true,
      "locked": false
    },
    {
      "id": "defense-gain",
      "type": "text",
      "label": "Gain",
      "x": 228,
      "y": 196,
      "w": 90,
      "h": 52,
      "anchor": "top-left",
      "binding": "primary.defense.gain",
      "material": "",
      "assetRef": "",
      "visible": true,
      "locked": false
    },
    {
      "id": "spellPower",
      "type": "icon",
      "label": "spellPower",
      "x": 332,
      "y": 196,
      "w": 42,
      "h": 42,
      "anchor": "top-left",
      "binding": "primary.spellPower",
      "material": "",
      "assetRef": "",
      "visible": true,
      "locked": false
    },
    {
      "id": "spellPower-gain",
      "type": "text",
      "label": "Gain",
      "x": 376,
      "y": 196,
      "w": 90,
      "h": 52,
      "anchor": "top-left",
      "binding": "primary.spellPower.gain",
      "material": "",
      "assetRef": "",
      "visible": true,
      "locked": false
    },
    {
      "id": "knowledge",
      "type": "icon",
      "label": "knowledge",
      "x": 480,
      "y": 196,
      "w": 42,
      "h": 42,
      "anchor": "top-left",
      "binding": "primary.knowledge",
      "material": "",
      "assetRef": "",
      "visible": true,
      "locked": false
    },
    {
      "id": "knowledge-gain",
      "type": "text",
      "label": "Gain",
      "x": 524,
      "y": 196,
      "w": 90,
      "h": 52,
      "anchor": "top-left",
      "binding": "primary.knowledge.gain",
      "material": "",
      "assetRef": "",
      "visible": true,
      "locked": false
    },
    {
      "id": "skill-0",
      "type": "perk",
      "label": "Skill offer",
      "x": 24,
      "y": 294,
      "w": 284,
      "h": 96,
      "anchor": "top-left",
      "binding": "offers.skills[0]",
      "material": "leather",
      "assetRef": "",
      "visible": true,
      "locked": false
    },
    {
      "id": "perk-0",
      "type": "perk",
      "label": "Perk offer",
      "x": 332,
      "y": 294,
      "w": 284,
      "h": 96,
      "anchor": "top-left",
      "binding": "offers.perks[0]",
      "material": "leather",
      "assetRef": "",
      "visible": true,
      "locked": false
    },
    {
      "id": "skill-1",
      "type": "perk",
      "label": "Skill offer",
      "x": 24,
      "y": 402,
      "w": 284,
      "h": 96,
      "anchor": "top-left",
      "binding": "offers.skills[1]",
      "material": "leather",
      "assetRef": "",
      "visible": true,
      "locked": false
    },
    {
      "id": "perk-1",
      "type": "perk",
      "label": "Perk offer",
      "x": 332,
      "y": 402,
      "w": 284,
      "h": 96,
      "anchor": "top-left",
      "binding": "offers.perks[1]",
      "material": "leather",
      "assetRef": "",
      "visible": true,
      "locked": false
    },
    {
      "id": "instruction",
      "type": "text",
      "label": "Choose an offer",
      "x": 150,
      "y": 502,
      "w": 340,
      "h": 28,
      "anchor": "top-left",
      "binding": "selection.instructions",
      "material": "",
      "assetRef": "",
      "visible": true,
      "locked": false
    },
    {
      "id": "previous",
      "type": "button",
      "label": "←",
      "x": 24,
      "y": 532,
      "w": 32,
      "h": 32,
      "anchor": "top-left",
      "binding": "page.previous",
      "material": "",
      "assetRef": "core:HSBTNS3",
      "visible": true,
      "locked": false
    },
    {
      "id": "next",
      "type": "button",
      "label": "→",
      "x": 66,
      "y": 532,
      "w": 32,
      "h": 32,
      "anchor": "top-left",
      "binding": "page.next",
      "material": "",
      "assetRef": "",
      "visible": true,
      "locked": false
    },
    {
      "id": "okay",
      "type": "button",
      "label": "OK",
      "x": 288,
      "y": 532,
      "w": 64,
      "h": 32,
      "anchor": "top-left",
      "binding": "selection.confirm",
      "material": "",
      "assetRef": "",
      "visible": true,
      "locked": false
    }
  ]
}
